const establishmentData = [
    {
        "Nombre del establecimiento": "ESTANCIA LOS HELECHOS",
        "Razón Social": "MARIA MERCEDES RICHARDS",
        "Número CUIT": 27060751361.0,
        "WhatsApp": "1154032000",
        "Ubicación del ACM": "RP 61 km 30.5, Junín de los Andes, Prov. del Neuquen",
        "Email Address": "marisasly@yahoo.com",
        "Superficie del establecimiento en hectáreas": 2500.0,
        "Departamento donde se ubica el establecimiento": "HUILICHES",
        "Ubicación catastral (Sección - Fracción - Lote)": "13RR-019-2410-0000 LOTE 58",
        "Coordenada Geográfica ( punto de referencia centro del campo) Latitud y Longitud. ": "'-39.75137S,-71.31453O",
        "Su establecimiento está inscripto y habilitado como criadero de fauna silvestre": "No",
        "Marque el casillero de la especies para las que solicita la práctica de caza. mayor.  Estas especies son exclusivamente para caza en establecimientos debidamente inscriptos como Criaderos de Fauna Silvestre y habilitados como Áreas de Caza Mayor.": "Ciervo Colorado, Jabalí",
        "Dentro de su campo los ciervos: (marque lo que corresponde).": "Están presentes todo el año",
        "¿Posee algún tipo de estimación numérica sobre la cantidad de ciervos que alberga su establecimiento?": "Hasta 50 ciervos",
        "Dentro del intervalo elegido, indique a continuación el valor que UD estima": "30",
        "A este valor, qué porcentaje en mas y en menos, le asignará (Ej: estimación de 400 ciervos, con un 10%+/-, nos ubica el valor entre 360 y 440 ciervos).": "10",
        "En los últimos cinco años, el número de ciervos en su campo": "Se mantuvo estable",
        "De las superficies total del establecimiento, qué porcentaje estima Ud. Que es utilizado por los ciervos": "Entre 25 % y 50 %",
        "Dentro de su campo o realiza algún tipo de manejo o aprovechamiento de los ciervos colorados. ": "Caza deportiva de ciervos machos, Caza de selección de ciervos machos anormales, defectuosos o de baja calidad",
        " Indique si es de su interés mejorar la práctica de alguna de las modalidades anteriores? Cual / Cuales? ": "MEJORAMIENTO CALIDAD",
        "Con respecto a la proporción existente entre machos y hembras, podría indicar los porcentajes que observa de Machos y Hembras. ": "20%MACHOS 80%HEMBRAS",
        "Machos 20%": "20%MACHOS 80%HEMBRAS",
        "En cuanto a los ambientes que ocupan de manera preferencial los ciervos, seleccione los ambientes donde se encuentran presentes.": "Bosque denso, Mallín, Cañadones",
        "Podría estimar el número de ciervos que son extraídos de su establecimiento todos los años, por los cazadores furtivos?": "0",
        "Indique en forma aproximada, la cantidad de ejemplares de jabalí europeo que alberga su establecimiento.": "300",
        "En los últimos tres años, la población de jabalí europeo:": "Aumento",
        "Si es posible, indique en forma aproximada, la cantidad de pumas que alberga su establecimiento.": "2",
        "En los últimos tres años, la población de pumas": "Se mantuvo estable",
        "Si detectó daños provocados por puma durante el último año, cuantifique los mismos (tipo y cantidad de hacienda afectada): ": "NO",
        "En su establecimiento viven poblaciones de guanacos?": "No",
        "En los últimos 3 años, la población de guanacos": "No especificado",
        "Que cantidad de ejemplares de esta especie estima Ud. que alberga su establecimiento?": "No especificado",
        "Si bien la caza deportiva del guanaco no se encuentra habilitada, se pueden considerar casos especiales para la evaluación técnica de un eventual aprovechamiento de la especie en ciertos establecimientos. Solicitará Ud. dicha evaluación?": "No especificado",
        "Planilla completada por...": "MARIA MERCERDES RICHARDS",
        "Fecha ": "25/09/2025",
        "ID de envío": 4019,
        "Fecha de creación de envío": "2025-09-25 12:01:40",
        "Estado de envío": "read"
    },
    {
        "Nombre del establecimiento": "Guenechen S.A y F",
        "Razón Social": "Guenechen S.A y F",
        "Número CUIT": 30609392092.0,
        "WhatsApp": "'+542944638865",
        "Ubicación del ACM": "Ruta Provincial 61",
        "Email Address": "contrerasjorge63@gmail.com",
        "Superficie del establecimiento en hectáreas": 2800.0,
        "Departamento donde se ubica el establecimiento": "Huiliches",
        "Ubicación catastral (Sección - Fracción - Lote)": "Sección 13-RR-019-1923-0000",
        "Coordenada Geográfica ( punto de referencia centro del campo) Latitud y Longitud. ": "S 39°46'59.9\" / W 71°12'47\"",
        "Su establecimiento está inscripto y habilitado como criadero de fauna silvestre": "No",
        "Marque el casillero de la especies para las que solicita la práctica de caza. mayor.  Estas especies son exclusivamente para caza en establecimientos debidamente inscriptos como Criaderos de Fauna Silvestre y habilitados como Áreas de Caza Mayor.": "Ciervo Colorado, Jabalí",
        "Dentro de su campo los ciervos: (marque lo que corresponde).": "Están presentes todo el año",
        "¿Posee algún tipo de estimación numérica sobre la cantidad de ciervos que alberga su establecimiento?": "Entre 250 y 500 ciervos",
        "Dentro del intervalo elegido, indique a continuación el valor que UD estima": "300",
        "A este valor, qué porcentaje en mas y en menos, le asignará (Ej: estimación de 400 ciervos, con un 10%+/-, nos ubica el valor entre 360 y 440 ciervos).": "300+_",
        "En los últimos cinco años, el número de ciervos en su campo": "Se mantuvo estable",
        "De las superficies total del establecimiento, qué porcentaje estima Ud. Que es utilizado por los ciervos": "Mas de 75 %",
        "Dentro de su campo o realiza algún tipo de manejo o aprovechamiento de los ciervos colorados. ": "Caza deportiva de ciervos machos",
        " Indique si es de su interés mejorar la práctica de alguna de las modalidades anteriores? Cual / Cuales? ": "No",
        "Con respecto a la proporción existente entre machos y hembras, podría indicar los porcentajes que observa de Machos y Hembras. ": "40 machos 60 hembras",
        "Machos 20%": "40 machos 60 hembras",
        "En cuanto a los ambientes que ocupan de manera preferencial los ciervos, seleccione los ambientes donde se encuentran presentes.": "Mallín",
        "Podría estimar el número de ciervos que son extraídos de su establecimiento todos los años, por los cazadores furtivos?": "6",
        "Indique en forma aproximada, la cantidad de ejemplares de jabalí europeo que alberga su establecimiento.": "200",
        "En los últimos tres años, la población de jabalí europeo:": "Se mantuvo estable",
        "Si es posible, indique en forma aproximada, la cantidad de pumas que alberga su establecimiento.": "120",
        "En los últimos tres años, la población de pumas": "Se mantuvo estable",
        "Si detectó daños provocados por puma durante el último año, cuantifique los mismos (tipo y cantidad de hacienda afectada): ": "Ovejas y ciervos juveniles",
        "En su establecimiento viven poblaciones de guanacos?": "No",
        "En los últimos 3 años, la población de guanacos": "No especificado",
        "Que cantidad de ejemplares de esta especie estima Ud. que alberga su establecimiento?": "No especificado",
        "Si bien la caza deportiva del guanaco no se encuentra habilitada, se pueden considerar casos especiales para la evaluación técnica de un eventual aprovechamiento de la especie en ciertos establecimientos. Solicitará Ud. dicha evaluación?": "No especificado",
        "Planilla completada por...": "JORGE CONTRERAS",
        "Fecha ": "26/03/2025",
        "ID de envío": 1024,
        "Fecha de creación de envío": "2025-03-26 17:23:15",
        "Estado de envío": "read"
    },
    {
        "Nombre del establecimiento": "Estancia El Cerrito",
        "Razón Social": "Estancia El Cerrito",
        "Número CUIT": 27224557464.0,
        "WhatsApp": "2942418756",
        "Ubicación del ACM": "Ruta provincial n° 24",
        "Email Address": "amancay_heladeria@hotmail.com",
        "Superficie del establecimiento en hectáreas": 2018.0,
        "Departamento donde se ubica el establecimiento": "Catan Lil",
        "Ubicación catastral (Sección - Fracción - Lote)": "Lote 3 b",
        "Coordenada Geográfica ( punto de referencia centro del campo) Latitud y Longitud. ": "'-39.4000497, -70.7008775",
        "Su establecimiento está inscripto y habilitado como criadero de fauna silvestre": "No",
        "Marque el casillero de la especies para las que solicita la práctica de caza. mayor.  Estas especies son exclusivamente para caza en establecimientos debidamente inscriptos como Criaderos de Fauna Silvestre y habilitados como Áreas de Caza Mayor.": "Ciervo Colorado",
        "Dentro de su campo los ciervos: (marque lo que corresponde).": "Están presentes todo el año",
        "¿Posee algún tipo de estimación numérica sobre la cantidad de ciervos que alberga su establecimiento?": "Entre 50 y 250 ciervos",
        "Dentro del intervalo elegido, indique a continuación el valor que UD estima": "70",
        "A este valor, qué porcentaje en mas y en menos, le asignará (Ej: estimación de 400 ciervos, con un 10%+/-, nos ubica el valor entre 360 y 440 ciervos).": "10%",
        "En los últimos cinco años, el número de ciervos en su campo": "Se mantuvo estable",
        "De las superficies total del establecimiento, qué porcentaje estima Ud. Que es utilizado por los ciervos": "Menos de un 5 %",
        "Dentro de su campo o realiza algún tipo de manejo o aprovechamiento de los ciervos colorados. ": "Caza deportiva de ciervos machos",
        " Indique si es de su interés mejorar la práctica de alguna de las modalidades anteriores? Cual / Cuales? ": "F",
        "Con respecto a la proporción existente entre machos y hembras, podría indicar los porcentajes que observa de Machos y Hembras. ": "20% machos y 80% hembras",
        "Machos 20%": "Macho 20% hembras 80%",
        "En cuanto a los ambientes que ocupan de manera preferencial los ciervos, seleccione los ambientes donde se encuentran presentes.": "Mallín",
        "Podría estimar el número de ciervos que son extraídos de su establecimiento todos los años, por los cazadores furtivos?": "2",
        "Indique en forma aproximada, la cantidad de ejemplares de jabalí europeo que alberga su establecimiento.": "30",
        "En los últimos tres años, la población de jabalí europeo:": "Disminuyó",
        "Si es posible, indique en forma aproximada, la cantidad de pumas que alberga su establecimiento.": "10",
        "En los últimos tres años, la población de pumas": "Se mantuvo estable",
        "Si detectó daños provocados por puma durante el último año, cuantifique los mismos (tipo y cantidad de hacienda afectada): ": "Nada",
        "En su establecimiento viven poblaciones de guanacos?": "Si",
        "En los últimos 3 años, la población de guanacos": "Se mantuvo estable",
        "Que cantidad de ejemplares de esta especie estima Ud. que alberga su establecimiento?": "20",
        "Si bien la caza deportiva del guanaco no se encuentra habilitada, se pueden considerar casos especiales para la evaluación técnica de un eventual aprovechamiento de la especie en ciertos establecimientos. Solicitará Ud. dicha evaluación?": "No",
        "Planilla completada por...": "Maria Verónica Cordero",
        "Fecha ": "21/03/2025",
        "ID de envío": 844,
        "Fecha de creación de envío": "2025-03-21 10:56:45",
        "Estado de envío": "read"
    },
    {
        "Nombre del establecimiento": "La Mimí",
        "Razón Social": "Establecimiento Pil Pil SA",
        "Número CUIT": 33511188399.0,
        "WhatsApp": "2266520403",
        "Ubicación del ACM": "Ruta 50, paraje Sañico, Collon cura",
        "Email Address": "estanciasanico@gmail.com",
        "Superficie del establecimiento en hectáreas": 40.4,
        "Departamento donde se ubica el establecimiento": "Collon cura",
        "Ubicación catastral (Sección - Fracción - Lote)": "14RR0235975000",
        "Coordenada Geográfica ( punto de referencia centro del campo) Latitud y Longitud. ": "40°06'58\"S 70°25'44\"W",
        "Su establecimiento está inscripto y habilitado como criadero de fauna silvestre": "No",
        "Marque el casillero de la especies para las que solicita la práctica de caza. mayor.  Estas especies son exclusivamente para caza en establecimientos debidamente inscriptos como Criaderos de Fauna Silvestre y habilitados como Áreas de Caza Mayor.": "Ciervo Colorado, Jabalí",
        "Dentro de su campo los ciervos: (marque lo que corresponde).": "Están presentes todo el año",
        "¿Posee algún tipo de estimación numérica sobre la cantidad de ciervos que alberga su establecimiento?": "Entre 50 y 250 ciervos",
        "Dentro del intervalo elegido, indique a continuación el valor que UD estima": "220",
        "A este valor, qué porcentaje en mas y en menos, le asignará (Ej: estimación de 400 ciervos, con un 10%+/-, nos ubica el valor entre 360 y 440 ciervos).": "30",
        "En los últimos cinco años, el número de ciervos en su campo": "Aumentó",
        "De las superficies total del establecimiento, qué porcentaje estima Ud. Que es utilizado por los ciervos": "Entre 5 y 25 %",
        "Dentro de su campo o realiza algún tipo de manejo o aprovechamiento de los ciervos colorados. ": "Caza deportiva de ciervos machos, Caza de selección de ciervos machos anormales, defectuosos o de baja calidad",
        " Indique si es de su interés mejorar la práctica de alguna de las modalidades anteriores? Cual / Cuales? ": "No",
        "Con respecto a la proporción existente entre machos y hembras, podría indicar los porcentajes que observa de Machos y Hembras. ": "25% machos 75% hembras",
        "Machos 20%": "25%machos 75%hembras",
        "En cuanto a los ambientes que ocupan de manera preferencial los ciervos, seleccione los ambientes donde se encuentran presentes.": "Mallín, Cañadones, Coironal",
        "Podría estimar el número de ciervos que son extraídos de su establecimiento todos los años, por los cazadores furtivos?": "10",
        "Indique en forma aproximada, la cantidad de ejemplares de jabalí europeo que alberga su establecimiento.": "300-400",
        "En los últimos tres años, la población de jabalí europeo:": "Se mantuvo estable",
        "Si es posible, indique en forma aproximada, la cantidad de pumas que alberga su establecimiento.": "50",
        "En los últimos tres años, la población de pumas": "Aumento",
        "Si detectó daños provocados por puma durante el último año, cuantifique los mismos (tipo y cantidad de hacienda afectada): ": "5 terneros vacunos y 6 potrillos",
        "En su establecimiento viven poblaciones de guanacos?": "Si",
        "En los últimos 3 años, la población de guanacos": "Aumento",
        "Que cantidad de ejemplares de esta especie estima Ud. que alberga su establecimiento?": "400-500",
        "Si bien la caza deportiva del guanaco no se encuentra habilitada, se pueden considerar casos especiales para la evaluación técnica de un eventual aprovechamiento de la especie en ciertos establecimientos. Solicitará Ud. dicha evaluación?": "Si",
        "Planilla completada por...": "Luis Zingoni",
        "Fecha ": "18/03/2025",
        "ID de envío": 732,
        "Fecha de creación de envío": "2025-03-18 06:04:17",
        "Estado de envío": "read"
    },
    {
        "Nombre del establecimiento": "Estancia La Maria Juana",
        "Razón Social": "La Maria Juana S.A.",
        "Número CUIT": 30507925355.0,
        "WhatsApp": "'+5492942691429",
        "Ubicación del ACM": "Ruta Provincial 20 - Fortin 1° de Mayo Catan Lil",
        "Email Address": "renerambeaud@hotmail.com",
        "Superficie del establecimiento en hectáreas": 9850.0,
        "Departamento donde se ubica el establecimiento": "Catan Lil",
        "Ubicación catastral (Sección - Fracción - Lote)": "Lote E 11-RR-19-5464 Lote B 11-RR-19-5360",
        "Coordenada Geográfica ( punto de referencia centro del campo) Latitud y Longitud. ": "'-39.435079,-70.595264",
        "Su establecimiento está inscripto y habilitado como criadero de fauna silvestre": "Si",
        "Marque el casillero de la especies para las que solicita la práctica de caza. mayor.  Estas especies son exclusivamente para caza en establecimientos debidamente inscriptos como Criaderos de Fauna Silvestre y habilitados como Áreas de Caza Mayor.": "Ciervo Colorado, Jabalí",
        "Dentro de su campo los ciervos: (marque lo que corresponde).": "Están presentes todo el año",
        "¿Posee algún tipo de estimación numérica sobre la cantidad de ciervos que alberga su establecimiento?": "Entre 50 y 250 ciervos",
        "Dentro del intervalo elegido, indique a continuación el valor que UD estima": "200",
        "A este valor, qué porcentaje en mas y en menos, le asignará (Ej: estimación de 400 ciervos, con un 10%+/-, nos ubica el valor entre 360 y 440 ciervos).": "15%",
        "En los últimos cinco años, el número de ciervos en su campo": "Aumentó",
        "De las superficies total del establecimiento, qué porcentaje estima Ud. Que es utilizado por los ciervos": "Entre 50 y 75 %",
        "Dentro de su campo o realiza algún tipo de manejo o aprovechamiento de los ciervos colorados. ": "Caza deportiva de ciervos machos, Caza de selección de ciervos machos anormales, defectuosos o de baja calidad",
        " Indique si es de su interés mejorar la práctica de alguna de las modalidades anteriores? Cual / Cuales? ": "Seleccion de ejemplares defectuosos",
        "Con respecto a la proporción existente entre machos y hembras, podría indicar los porcentajes que observa de Machos y Hembras. ": "20% machos 80 % hembras",
        "Machos 20%": "machos 10% 90% hembras",
        "En cuanto a los ambientes que ocupan de manera preferencial los ciervos, seleccione los ambientes donde se encuentran presentes.": "Mallín, Cañadones",
        "Podría estimar el número de ciervos que son extraídos de su establecimiento todos los años, por los cazadores furtivos?": "5",
        "Indique en forma aproximada, la cantidad de ejemplares de jabalí europeo que alberga su establecimiento.": "50",
        "En los últimos tres años, la población de jabalí europeo:": "Se mantuvo estable",
        "Si es posible, indique en forma aproximada, la cantidad de pumas que alberga su establecimiento.": "10",
        "En los últimos tres años, la población de pumas": "Aumento",
        "Si detectó daños provocados por puma durante el último año, cuantifique los mismos (tipo y cantidad de hacienda afectada): ": "ovejas alrededor de 80 - choiques alrededor de 20",
        "En su establecimiento viven poblaciones de guanacos?": "No",
        "En los últimos 3 años, la población de guanacos": "No especificado",
        "Que cantidad de ejemplares de esta especie estima Ud. que alberga su establecimiento?": "No especificado",
        "Si bien la caza deportiva del guanaco no se encuentra habilitada, se pueden considerar casos especiales para la evaluación técnica de un eventual aprovechamiento de la especie en ciertos establecimientos. Solicitará Ud. dicha evaluación?": "No especificado",
        "Planilla completada por...": "Rene Santiago Rambeaud- Presidente de La Maria Juana S.A.",
        "Fecha ": "17/03/2025",
        "ID de envío": 679,
        "Fecha de creación de envío": "2025-03-17 12:00:53",
        "Estado de envío": "read"
    },
    {
        "Nombre del establecimiento": "Quilmahue",
        "Razón Social": "Estancias del Kilka S.A.",
        "Número CUIT": 30710452365.0,
        "WhatsApp": "2396542130",
        "Ubicación del ACM": "Paraje Quilachanquil, Zona Andina",
        "Email Address": "ericamoro9@hotmail.com",
        "Superficie del establecimiento en hectáreas": 2383.0,
        "Departamento donde se ubica el establecimiento": "Departamento Aluminé",
        "Ubicación catastral (Sección - Fracción - Lote)": "Lote 66, parte del lote 67 y 68 y cinco fracciones del lote 69",
        "Coordenada Geográfica ( punto de referencia centro del campo) Latitud y Longitud. ": "'-39.124532, -70.895353",
        "Su establecimiento está inscripto y habilitado como criadero de fauna silvestre": "Si",
        "Marque el casillero de la especies para las que solicita la práctica de caza. mayor.  Estas especies son exclusivamente para caza en establecimientos debidamente inscriptos como Criaderos de Fauna Silvestre y habilitados como Áreas de Caza Mayor.": "Ciervo Colorado, Ciervo dama, Ciervo del Padre David, Ciervo axis, Antílope de la India, Oveja multicuernos, Oveja común, Cabra Íbex alpina, Jabalí, Cabra común",
        "Dentro de su campo los ciervos: (marque lo que corresponde).": "Están presentes todo el año",
        "¿Posee algún tipo de estimación numérica sobre la cantidad de ciervos que alberga su establecimiento?": "Entre 50 y 250 ciervos",
        "Dentro del intervalo elegido, indique a continuación el valor que UD estima": "0 (cero)",
        "A este valor, qué porcentaje en mas y en menos, le asignará (Ej: estimación de 400 ciervos, con un 10%+/-, nos ubica el valor entre 360 y 440 ciervos).": "0 (cero)",
        "En los últimos cinco años, el número de ciervos en su campo": "Se mantuvo estable",
        "De las superficies total del establecimiento, qué porcentaje estima Ud. Que es utilizado por los ciervos": "Entre 5 y 25 %",
        "Dentro de su campo o realiza algún tipo de manejo o aprovechamiento de los ciervos colorados. ": "Caza deportiva de ciervos machos, Caza de selección de ciervos machos anormales, defectuosos o de baja calidad, Caza de control de cualquier ejemplar por interferencia con sistemas productivos",
        " Indique si es de su interés mejorar la práctica de alguna de las modalidades anteriores? Cual / Cuales? ": "No",
        "Con respecto a la proporción existente entre machos y hembras, podría indicar los porcentajes que observa de Machos y Hembras. ": "30% Machos - 70% Hembras",
        "Machos 20%": "Macho 20% - Hembras 80%",
        "En cuanto a los ambientes que ocupan de manera preferencial los ciervos, seleccione los ambientes donde se encuentran presentes.": "Bosque denso, Estepa arbustiva alta, Estepa arbustiva baja, Bosque abierto, tipo parque, Costa de ríos e isla, Mallín, Cañadones, Coironal",
        "Podría estimar el número de ciervos que son extraídos de su establecimiento todos los años, por los cazadores furtivos?": "20",
        "Indique en forma aproximada, la cantidad de ejemplares de jabalí europeo que alberga su establecimiento.": "20",
        "En los últimos tres años, la población de jabalí europeo:": "Aumento",
        "Si es posible, indique en forma aproximada, la cantidad de pumas que alberga su establecimiento.": "10",
        "En los últimos tres años, la población de pumas": "Aumento",
        "Si detectó daños provocados por puma durante el último año, cuantifique los mismos (tipo y cantidad de hacienda afectada): ": "5 vacas",
        "En su establecimiento viven poblaciones de guanacos?": "No",
        "En los últimos 3 años, la población de guanacos": "No especificado",
        "Que cantidad de ejemplares de esta especie estima Ud. que alberga su establecimiento?": "No especificado",
        "Si bien la caza deportiva del guanaco no se encuentra habilitada, se pueden considerar casos especiales para la evaluación técnica de un eventual aprovechamiento de la especie en ciertos establecimientos. Solicitará Ud. dicha evaluación?": "No especificado",
        "Planilla completada por...": "Gastón Moore",
        "Fecha ": "15/03/2025",
        "ID de envío": 635,
        "Fecha de creación de envío": "2025-03-15 11:50:03",
        "Estado de envío": "read"
    },
    {
        "Nombre del establecimiento": "El Recuerdo",
        "Razón Social": "Pedro Alberto Ochoa",
        "Número CUIT": 20.0,
        "WhatsApp": "2942572525",
        "Ubicación del ACM": "Ruta pcial N46 km 116 paraje Quillen",
        "Email Address": "elrecuerdo8a@yahoo.com.ar",
        "Superficie del establecimiento en hectáreas": 775.0,
        "Departamento donde se ubica el establecimiento": "Alumine",
        "Ubicación catastral (Sección - Fracción - Lote)": "Sección C fracción 31 lote B",
        "Coordenada Geográfica ( punto de referencia centro del campo) Latitud y Longitud. ": "'-39.376564,-70951231.-39.370747,-70.968309.-39419961,-70.950988.-39.419994,-70.968135",
        "Su establecimiento está inscripto y habilitado como criadero de fauna silvestre": "No",
        "Marque el casillero de la especies para las que solicita la práctica de caza. mayor.  Estas especies son exclusivamente para caza en establecimientos debidamente inscriptos como Criaderos de Fauna Silvestre y habilitados como Áreas de Caza Mayor.": "Ciervo Colorado, Jabalí",
        "Dentro de su campo los ciervos: (marque lo que corresponde).": "Están presentes todo el año",
        "¿Posee algún tipo de estimación numérica sobre la cantidad de ciervos que alberga su establecimiento?": "Entre 50 y 250 ciervos",
        "Dentro del intervalo elegido, indique a continuación el valor que UD estima": "200",
        "A este valor, qué porcentaje en mas y en menos, le asignará (Ej: estimación de 400 ciervos, con un 10%+/-, nos ubica el valor entre 360 y 440 ciervos).": "10%",
        "En los últimos cinco años, el número de ciervos en su campo": "Se mantuvo estable",
        "De las superficies total del establecimiento, qué porcentaje estima Ud. Que es utilizado por los ciervos": "Entre 50 y 75 %",
        "Dentro de su campo o realiza algún tipo de manejo o aprovechamiento de los ciervos colorados. ": "Caza deportiva de ciervos machos, Caza de selección de ciervos machos anormales, defectuosos o de baja calidad, Caza de control de ciervos hembra (sin aprovechamiento de la carne)",
        " Indique si es de su interés mejorar la práctica de alguna de las modalidades anteriores? Cual / Cuales? ": "La caza de control de ciervas con aprobéchamiento de la carne",
        "Con respecto a la proporción existente entre machos y hembras, podría indicar los porcentajes que observa de Machos y Hembras. ": "25%machos 75%hembras",
        "Machos 20%": "25% machos 75%hembras",
        "En cuanto a los ambientes que ocupan de manera preferencial los ciervos, seleccione los ambientes donde se encuentran presentes.": "Estepa arbustiva baja, Mallín, Cañadones, Coironal",
        "Podría estimar el número de ciervos que son extraídos de su establecimiento todos los años, por los cazadores furtivos?": "2",
        "Indique en forma aproximada, la cantidad de ejemplares de jabalí europeo que alberga su establecimiento.": "60",
        "En los últimos tres años, la población de jabalí europeo:": "Aumento",
        "Si es posible, indique en forma aproximada, la cantidad de pumas que alberga su establecimiento.": "3",
        "En los últimos tres años, la población de pumas": "Se mantuvo estable",
        "Si detectó daños provocados por puma durante el último año, cuantifique los mismos (tipo y cantidad de hacienda afectada): ": "2potrillos",
        "En su establecimiento viven poblaciones de guanacos?": "No",
        "En los últimos 3 años, la población de guanacos": "No especificado",
        "Que cantidad de ejemplares de esta especie estima Ud. que alberga su establecimiento?": "No especificado",
        "Si bien la caza deportiva del guanaco no se encuentra habilitada, se pueden considerar casos especiales para la evaluación técnica de un eventual aprovechamiento de la especie en ciertos establecimientos. Solicitará Ud. dicha evaluación?": "No especificado",
        "Planilla completada por...": "Pedro Alberto Ochoa",
        "Fecha ": "13/03/2025",
        "ID de envío": 586,
        "Fecha de creación de envío": "2025-03-13 16:21:28",
        "Estado de envío": "read"
    },
    {
        "Nombre del establecimiento": "Estancia Los Lirios",
        "Razón Social": "Cerro de los Lirios",
        "Número CUIT": 94135957.0,
        "WhatsApp": "2942574193",
        "Ubicación del ACM": "Ruta 23 km 6 quillen",
        "Email Address": "estanciaquillen@yahoo.com.ar",
        "Superficie del establecimiento en hectáreas": 1760.0,
        "Departamento donde se ubica el establecimiento": "Alumine",
        "Ubicación catastral (Sección - Fracción - Lote)": "12RR01963390000",
        "Coordenada Geográfica ( punto de referencia centro del campo) Latitud y Longitud. ": "20....",
        "Su establecimiento está inscripto y habilitado como criadero de fauna silvestre": "No",
        "Marque el casillero de la especies para las que solicita la práctica de caza. mayor.  Estas especies son exclusivamente para caza en establecimientos debidamente inscriptos como Criaderos de Fauna Silvestre y habilitados como Áreas de Caza Mayor.": "Ciervo Colorado",
        "Dentro de su campo los ciervos: (marque lo que corresponde).": "Están presentes todo el año",
        "¿Posee algún tipo de estimación numérica sobre la cantidad de ciervos que alberga su establecimiento?": "Entre 250 y 500 ciervos",
        "Dentro del intervalo elegido, indique a continuación el valor que UD estima": "280",
        "A este valor, qué porcentaje en mas y en menos, le asignará (Ej: estimación de 400 ciervos, con un 10%+/-, nos ubica el valor entre 360 y 440 ciervos).": "aprox 360",
        "En los últimos cinco años, el número de ciervos en su campo": "Aumentó",
        "De las superficies total del establecimiento, qué porcentaje estima Ud. Que es utilizado por los ciervos": "Entre 25 % y 50 %",
        "Dentro de su campo o realiza algún tipo de manejo o aprovechamiento de los ciervos colorados. ": "Caza deportiva de ciervos machos",
        " Indique si es de su interés mejorar la práctica de alguna de las modalidades anteriores? Cual / Cuales? ": "si caza deportiva ciervo colorado",
        "Con respecto a la proporción existente entre machos y hembras, podría indicar los porcentajes que observa de Machos y Hembras. ": "30% hembras 70% machos",
        "Machos 20%": "machos 30% y hembras 70%",
        "En cuanto a los ambientes que ocupan de manera preferencial los ciervos, seleccione los ambientes donde se encuentran presentes.": "Estepa arbustiva baja",
        "Podría estimar el número de ciervos que son extraídos de su establecimiento todos los años, por los cazadores furtivos?": "6",
        "Indique en forma aproximada, la cantidad de ejemplares de jabalí europeo que alberga su establecimiento.": "aprox 2000",
        "En los últimos tres años, la población de jabalí europeo:": "Aumento",
        "Si es posible, indique en forma aproximada, la cantidad de pumas que alberga su establecimiento.": "muy poco",
        "En los últimos tres años, la población de pumas": "Se mantuvo estable",
        "Si detectó daños provocados por puma durante el último año, cuantifique los mismos (tipo y cantidad de hacienda afectada): ": "muy poco",
        "En su establecimiento viven poblaciones de guanacos?": "No",
        "En los últimos 3 años, la población de guanacos": "No especificado",
        "Que cantidad de ejemplares de esta especie estima Ud. que alberga su establecimiento?": "No especificado",
        "Si bien la caza deportiva del guanaco no se encuentra habilitada, se pueden considerar casos especiales para la evaluación técnica de un eventual aprovechamiento de la especie en ciertos establecimientos. Solicitará Ud. dicha evaluación?": "No especificado",
        "Planilla completada por...": "Julia Diaz",
        "Fecha ": "13/03/2025",
        "ID de envío": 568,
        "Fecha de creación de envío": "2025-03-13 11:43:55",
        "Estado de envío": "read"
    },
    {
        "Nombre del establecimiento": "Estancias Los Peucos y Los Ranchos",
        "Razón Social": "Bosque Andino SA",
        "Número CUIT": 30.0,
        "WhatsApp": "'+5492944626159",
        "Ubicación del ACM": "Paraje Atreuco y Paraje Pilo Lil",
        "Email Address": "bertil.hoepke@gmail.com",
        "Superficie del establecimiento en hectáreas": 10900.0,
        "Departamento donde se ubica el establecimiento": "Huiliches",
        "Ubicación catastral (Sección - Fracción - Lote)": "13-RR 19 2734 y 2634 y 4351",
        "Coordenada Geográfica ( punto de referencia centro del campo) Latitud y Longitud. ": "39°43'42.78\"S 71° 3'36.80\"O",
        "Su establecimiento está inscripto y habilitado como criadero de fauna silvestre": "Si",
        "Marque el casillero de la especies para las que solicita la práctica de caza. mayor.  Estas especies son exclusivamente para caza en establecimientos debidamente inscriptos como Criaderos de Fauna Silvestre y habilitados como Áreas de Caza Mayor.": "Ciervo Colorado, Jabalí",
        "Dentro de su campo los ciervos: (marque lo que corresponde).": "Están presentes todo el año",
        "¿Posee algún tipo de estimación numérica sobre la cantidad de ciervos que alberga su establecimiento?": "Mas de 1000 ciervos",
        "Dentro del intervalo elegido, indique a continuación el valor que UD estima": "1100",
        "A este valor, qué porcentaje en mas y en menos, le asignará (Ej: estimación de 400 ciervos, con un 10%+/-, nos ubica el valor entre 360 y 440 ciervos).": "20%",
        "En los últimos cinco años, el número de ciervos en su campo": "Aumentó",
        "De las superficies total del establecimiento, qué porcentaje estima Ud. Que es utilizado por los ciervos": "Mas de 75 %",
        "Dentro de su campo o realiza algún tipo de manejo o aprovechamiento de los ciervos colorados. ": "Caza deportiva de ciervos machos, Caza de selección de ciervos machos anormales, defectuosos o de baja calidad, Caza de control de cualquier ejemplar por interferencia con sistemas productivos",
        " Indique si es de su interés mejorar la práctica de alguna de las modalidades anteriores? Cual / Cuales? ": "Si Caza control pero con aprovechamiento de la carne",
        "Con respecto a la proporción existente entre machos y hembras, podría indicar los porcentajes que observa de Machos y Hembras. ": "1 ciervo cada 15 hembras en Brama",
        "Machos 20%": "1 ciervo cada 25 hembras",
        "En cuanto a los ambientes que ocupan de manera preferencial los ciervos, seleccione los ambientes donde se encuentran presentes.": "Estepa arbustiva alta, Estepa arbustiva baja, Bosque abierto, tipo parque, Costa de ríos e isla, Mallín, Cañadones, Coironal, Otros",
        "Podría estimar el número de ciervos que son extraídos de su establecimiento todos los años, por los cazadores furtivos?": "80",
        "Indique en forma aproximada, la cantidad de ejemplares de jabalí europeo que alberga su establecimiento.": "500 aprox",
        "En los últimos tres años, la población de jabalí europeo:": "Aumento",
        "Si es posible, indique en forma aproximada, la cantidad de pumas que alberga su establecimiento.": "No poseemos estimaciones",
        "En los últimos tres años, la población de pumas": "Se mantuvo estable",
        "Si detectó daños provocados por puma durante el último año, cuantifique los mismos (tipo y cantidad de hacienda afectada): ": "Mayormente guanacos del criadero y ciervas y chulengos",
        "En su establecimiento viven poblaciones de guanacos?": "Si",
        "En los últimos 3 años, la población de guanacos": "Aumento",
        "Que cantidad de ejemplares de esta especie estima Ud. que alberga su establecimiento?": "400 aprox",
        "Si bien la caza deportiva del guanaco no se encuentra habilitada, se pueden considerar casos especiales para la evaluación técnica de un eventual aprovechamiento de la especie en ciertos establecimientos. Solicitará Ud. dicha evaluación?": "Si",
        "Planilla completada por...": "Bertil A Hoepke P",
        "Fecha ": "12/03/2025",
        "ID de envío": 533,
        "Fecha de creación de envío": "2025-03-12 17:58:14",
        "Estado de envío": "read"
    },
    {
        "Nombre del establecimiento": "Pilolil",
        "Razón Social": "Estancia Pilolil",
        "Número CUIT": 33517148089.0,
        "WhatsApp": "1139332867",
        "Ubicación del ACM": "Ruta 23, Estancia Pilolil",
        "Email Address": "joseidonovan@gmail.com",
        "Superficie del establecimiento en hectáreas": 9900.0,
        "Departamento donde se ubica el establecimiento": "Huiliches",
        "Ubicación catastral (Sección - Fracción - Lote)": "Depto Huliche - Fraccion A - Lote 54 - zona andina C",
        "Coordenada Geográfica ( punto de referencia centro del campo) Latitud y Longitud. ": "39.643545,70.947995",
        "Su establecimiento está inscripto y habilitado como criadero de fauna silvestre": "Si",
        "Marque el casillero de la especies para las que solicita la práctica de caza. mayor.  Estas especies son exclusivamente para caza en establecimientos debidamente inscriptos como Criaderos de Fauna Silvestre y habilitados como Áreas de Caza Mayor.": "Ciervo Colorado",
        "Dentro de su campo los ciervos: (marque lo que corresponde).": "Están presentes todo el año",
        "¿Posee algún tipo de estimación numérica sobre la cantidad de ciervos que alberga su establecimiento?": "Entre 50 y 250 ciervos",
        "Dentro del intervalo elegido, indique a continuación el valor que UD estima": "300",
        "A este valor, qué porcentaje en mas y en menos, le asignará (Ej: estimación de 400 ciervos, con un 10%+/-, nos ubica el valor entre 360 y 440 ciervos).": "10",
        "En los últimos cinco años, el número de ciervos en su campo": "Aumentó",
        "De las superficies total del establecimiento, qué porcentaje estima Ud. Que es utilizado por los ciervos": "Menos de un 5 %",
        "Dentro de su campo o realiza algún tipo de manejo o aprovechamiento de los ciervos colorados. ": "Caza deportiva de ciervos machos, Caza de selección de ciervos machos anormales, defectuosos o de baja calidad",
        " Indique si es de su interés mejorar la práctica de alguna de las modalidades anteriores? Cual / Cuales? ": "No",
        "Con respecto a la proporción existente entre machos y hembras, podría indicar los porcentajes que observa de Machos y Hembras. ": "30-70",
        "Machos 20%": "20-80",
        "En cuanto a los ambientes que ocupan de manera preferencial los ciervos, seleccione los ambientes donde se encuentran presentes.": "Estepa arbustiva baja, Mallín, Cañadones",
        "Podría estimar el número de ciervos que son extraídos de su establecimiento todos los años, por los cazadores furtivos?": "15",
        "Indique en forma aproximada, la cantidad de ejemplares de jabalí europeo que alberga su establecimiento.": "100",
        "En los últimos tres años, la población de jabalí europeo:": "Aumento",
        "Si es posible, indique en forma aproximada, la cantidad de pumas que alberga su establecimiento.": "20",
        "En los últimos tres años, la población de pumas": "Aumento",
        "Si detectó daños provocados por puma durante el último año, cuantifique los mismos (tipo y cantidad de hacienda afectada): ": "2 ciervos, 2 terneros",
        "En su establecimiento viven poblaciones de guanacos?": "Si",
        "En los últimos 3 años, la población de guanacos": "Aumento",
        "Que cantidad de ejemplares de esta especie estima Ud. que alberga su establecimiento?": "30",
        "Si bien la caza deportiva del guanaco no se encuentra habilitada, se pueden considerar casos especiales para la evaluación técnica de un eventual aprovechamiento de la especie en ciertos establecimientos. Solicitará Ud. dicha evaluación?": "No",
        "Planilla completada por...": "Guillermo Minieri",
        "Fecha ": "11/03/2025",
        "ID de envío": 501,
        "Fecha de creación de envío": "2025-03-11 16:11:16",
        "Estado de envío": "read"
    },
    {
        "Nombre del establecimiento": "ESTANCIA LA RINCONADA",
        "Razón Social": "SANTA GRACIELA S.A.",
        "Número CUIT": 30672606434.0,
        "WhatsApp": "2944511287",
        "Ubicación del ACM": "RUTA 40",
        "Email Address": "veronica@fercap.com.ar",
        "Superficie del establecimiento en hectáreas": 7000.0,
        "Departamento donde se ubica el establecimiento": "COLLON CURA",
        "Ubicación catastral (Sección - Fracción - Lote)": "14RR0236257000",
        "Coordenada Geográfica ( punto de referencia centro del campo) Latitud y Longitud. ": "'-38-68",
        "Su establecimiento está inscripto y habilitado como criadero de fauna silvestre": "No",
        "Marque el casillero de la especies para las que solicita la práctica de caza. mayor.  Estas especies son exclusivamente para caza en establecimientos debidamente inscriptos como Criaderos de Fauna Silvestre y habilitados como Áreas de Caza Mayor.": "Ciervo Colorado, Jabalí",
        "Dentro de su campo los ciervos: (marque lo que corresponde).": "Están presentes todo el año",
        "¿Posee algún tipo de estimación numérica sobre la cantidad de ciervos que alberga su establecimiento?": "Entre 500 y 1000 ciervos",
        "Dentro del intervalo elegido, indique a continuación el valor que UD estima": "700",
        "A este valor, qué porcentaje en mas y en menos, le asignará (Ej: estimación de 400 ciervos, con un 10%+/-, nos ubica el valor entre 360 y 440 ciervos).": "10",
        "En los últimos cinco años, el número de ciervos en su campo": "Disminuyó",
        "De las superficies total del establecimiento, qué porcentaje estima Ud. Que es utilizado por los ciervos": "Entre 5 y 25 %",
        "Dentro de su campo o realiza algún tipo de manejo o aprovechamiento de los ciervos colorados. ": "Caza deportiva de ciervos machos, Caza de selección de ciervos machos anormales, defectuosos o de baja calidad",
        " Indique si es de su interés mejorar la práctica de alguna de las modalidades anteriores? Cual / Cuales? ": "NO",
        "Con respecto a la proporción existente entre machos y hembras, podría indicar los porcentajes que observa de Machos y Hembras. ": "20% MACHOS- 80 % HEMBRAS",
        "Machos 20%": "10% MACHOS-90 % HEMBRAS",
        "En cuanto a los ambientes que ocupan de manera preferencial los ciervos, seleccione los ambientes donde se encuentran presentes.": "Estepa arbustiva alta, Estepa arbustiva baja, Bosque abierto, tipo parque, Mallín",
        "Podría estimar el número de ciervos que son extraídos de su establecimiento todos los años, por los cazadores furtivos?": "30",
        "Indique en forma aproximada, la cantidad de ejemplares de jabalí europeo que alberga su establecimiento.": "150",
        "En los últimos tres años, la población de jabalí europeo:": "Aumento",
        "Si es posible, indique en forma aproximada, la cantidad de pumas que alberga su establecimiento.": "5",
        "En los últimos tres años, la población de pumas": "Aumento",
        "Si detectó daños provocados por puma durante el último año, cuantifique los mismos (tipo y cantidad de hacienda afectada): ": "NO",
        "En su establecimiento viven poblaciones de guanacos?": "Si",
        "En los últimos 3 años, la población de guanacos": "Se mantuvo estable",
        "Que cantidad de ejemplares de esta especie estima Ud. que alberga su establecimiento?": "NO",
        "Si bien la caza deportiva del guanaco no se encuentra habilitada, se pueden considerar casos especiales para la evaluación técnica de un eventual aprovechamiento de la especie en ciertos establecimientos. Solicitará Ud. dicha evaluación?": "No",
        "Planilla completada por...": "JAVIER FERNANDEZ CAPIET",
        "Fecha ": "11/03/2025",
        "ID de envío": 492,
        "Fecha de creación de envío": "2025-03-11 14:29:42",
        "Estado de envío": "read"
    },
    {
        "Nombre del establecimiento": "Estancia Quillen",
        "Razón Social": "Estancia Quillen",
        "Número CUIT": 23057908114.0,
        "WhatsApp": "2942574193",
        "Ubicación del ACM": "Ruta 23 km7",
        "Email Address": "estanciaquillen@yahoo.com.ar",
        "Superficie del establecimiento en hectáreas": 7300.0,
        "Departamento donde se ubica el establecimiento": "Alumine",
        "Ubicación catastral (Sección - Fracción - Lote)": "12RR01957370000",
        "Coordenada Geográfica ( punto de referencia centro del campo) Latitud y Longitud. ": "3937463558695226 (7104095w)",
        "Su establecimiento está inscripto y habilitado como criadero de fauna silvestre": "No",
        "Marque el casillero de la especies para las que solicita la práctica de caza. mayor.  Estas especies son exclusivamente para caza en establecimientos debidamente inscriptos como Criaderos de Fauna Silvestre y habilitados como Áreas de Caza Mayor.": "Ciervo Colorado",
        "Dentro de su campo los ciervos: (marque lo que corresponde).": "Están presentes todo el año",
        "¿Posee algún tipo de estimación numérica sobre la cantidad de ciervos que alberga su establecimiento?": "Entre 500 y 1000 ciervos",
        "Dentro del intervalo elegido, indique a continuación el valor que UD estima": "400",
        "A este valor, qué porcentaje en mas y en menos, le asignará (Ej: estimación de 400 ciervos, con un 10%+/-, nos ubica el valor entre 360 y 440 ciervos).": "400",
        "En los últimos cinco años, el número de ciervos en su campo": "Aumentó",
        "De las superficies total del establecimiento, qué porcentaje estima Ud. Que es utilizado por los ciervos": "Entre 5 y 25 %",
        "Dentro de su campo o realiza algún tipo de manejo o aprovechamiento de los ciervos colorados. ": "Caza deportiva de ciervos machos",
        " Indique si es de su interés mejorar la práctica de alguna de las modalidades anteriores? Cual / Cuales? ": "no se",
        "Con respecto a la proporción existente entre machos y hembras, podría indicar los porcentajes que observa de Machos y Hembras. ": "20 % machos 80% hembras",
        "Machos 20%": "machos 20% hembras 80%",
        "En cuanto a los ambientes que ocupan de manera preferencial los ciervos, seleccione los ambientes donde se encuentran presentes.": "Mallín",
        "Podría estimar el número de ciervos que son extraídos de su establecimiento todos los años, por los cazadores furtivos?": "6",
        "Indique en forma aproximada, la cantidad de ejemplares de jabalí europeo que alberga su establecimiento.": "mas de 4000",
        "En los últimos tres años, la población de jabalí europeo:": "Aumento",
        "Si es posible, indique en forma aproximada, la cantidad de pumas que alberga su establecimiento.": "12",
        "En los últimos tres años, la población de pumas": "Se mantuvo estable",
        "Si detectó daños provocados por puma durante el último año, cuantifique los mismos (tipo y cantidad de hacienda afectada): ": "matanza de corderos y chulengos (ciervos)",
        "En su establecimiento viven poblaciones de guanacos?": "No",
        "En los últimos 3 años, la población de guanacos": "No especificado",
        "Que cantidad de ejemplares de esta especie estima Ud. que alberga su establecimiento?": "No especificado",
        "Si bien la caza deportiva del guanaco no se encuentra habilitada, se pueden considerar casos especiales para la evaluación técnica de un eventual aprovechamiento de la especie en ciertos establecimientos. Solicitará Ud. dicha evaluación?": "No especificado",
        "Planilla completada por...": "Julia Adriana Díaz",
        "Fecha ": "10/03/2025",
        "ID de envío": 482,
        "Fecha de creación de envío": "2025-03-10 19:41:54",
        "Estado de envío": "read"
    },
    {
        "Nombre del establecimiento": "las pircas",
        "Razón Social": "las pircas",
        "Número CUIT": 20269314436.0,
        "WhatsApp": "2942339515",
        "Ubicación del ACM": "ruta 46 km 75 espinazo del zorro",
        "Email Address": "laspircasea@gmail.com",
        "Superficie del establecimiento en hectáreas": 7147.0,
        "Departamento donde se ubica el establecimiento": "Catán Lil",
        "Ubicación catastral (Sección - Fracción - Lote)": "sección XXVII lote 9 y parte de 8,10,16,11 y 17. sección B zona andina lote 108 y 109",
        "Coordenada Geográfica ( punto de referencia centro del campo) Latitud y Longitud. ": "'-39.269647,-70.580373",
        "Su establecimiento está inscripto y habilitado como criadero de fauna silvestre": "Si",
        "Marque el casillero de la especies para las que solicita la práctica de caza. mayor.  Estas especies son exclusivamente para caza en establecimientos debidamente inscriptos como Criaderos de Fauna Silvestre y habilitados como Áreas de Caza Mayor.": "Ciervo Colorado",
        "Dentro de su campo los ciervos: (marque lo que corresponde).": "Están presentes todo el año",
        "¿Posee algún tipo de estimación numérica sobre la cantidad de ciervos que alberga su establecimiento?": "Entre 250 y 500 ciervos",
        "Dentro del intervalo elegido, indique a continuación el valor que UD estima": "400",
        "A este valor, qué porcentaje en mas y en menos, le asignará (Ej: estimación de 400 ciervos, con un 10%+/-, nos ubica el valor entre 360 y 440 ciervos).": "10",
        "En los últimos cinco años, el número de ciervos en su campo": "Aumentó",
        "De las superficies total del establecimiento, qué porcentaje estima Ud. Que es utilizado por los ciervos": "Entre 25 % y 50 %",
        "Dentro de su campo o realiza algún tipo de manejo o aprovechamiento de los ciervos colorados. ": "Caza deportiva de ciervos machos, Caza de selección de ciervos machos anormales, defectuosos o de baja calidad",
        " Indique si es de su interés mejorar la práctica de alguna de las modalidades anteriores? Cual / Cuales? ": "caza de machos anormales",
        "Con respecto a la proporción existente entre machos y hembras, podría indicar los porcentajes que observa de Machos y Hembras. ": "30 machos 70.hembras",
        "Machos 20%": "30 machos 70 hembras",
        "En cuanto a los ambientes que ocupan de manera preferencial los ciervos, seleccione los ambientes donde se encuentran presentes.": "Cañadones, Coironal, Mallín, Costa de ríos e isla",
        "Podría estimar el número de ciervos que son extraídos de su establecimiento todos los años, por los cazadores furtivos?": "20",
        "Indique en forma aproximada, la cantidad de ejemplares de jabalí europeo que alberga su establecimiento.": "20 errático",
        "En los últimos tres años, la población de jabalí europeo:": "Se mantuvo estable",
        "Si es posible, indique en forma aproximada, la cantidad de pumas que alberga su establecimiento.": "entre 2 y 10",
        "En los últimos tres años, la población de pumas": "Se mantuvo estable",
        "Si detectó daños provocados por puma durante el último año, cuantifique los mismos (tipo y cantidad de hacienda afectada): ": "nada de daño...tenemos ppg",
        "En su establecimiento viven poblaciones de guanacos?": "Si",
        "En los últimos 3 años, la población de guanacos": "Se mantuvo estable",
        "Que cantidad de ejemplares de esta especie estima Ud. que alberga su establecimiento?": "20",
        "Si bien la caza deportiva del guanaco no se encuentra habilitada, se pueden considerar casos especiales para la evaluación técnica de un eventual aprovechamiento de la especie en ciertos establecimientos. Solicitará Ud. dicha evaluación?": "No",
        "Planilla completada por...": "Abel Martinez",
        "Fecha ": "10/03/2025",
        "ID de envío": 476,
        "Fecha de creación de envío": "2025-03-10 13:28:28",
        "Estado de envío": "read"
    },
    {
        "Nombre del establecimiento": "Estancia Santa Isabel",
        "Razón Social": "Ganadera Santa Isabel SA",
        "Número CUIT": 30686301350.0,
        "WhatsApp": "1135600494",
        "Ubicación del ACM": "Ruta 40 - Catan-Lil",
        "Email Address": "etiennefdc@gmail.com",
        "Superficie del establecimiento en hectáreas": 48000.0,
        "Departamento donde se ubica el establecimiento": "Collon cura",
        "Ubicación catastral (Sección - Fracción - Lote)": "14-RR-24-7002",
        "Coordenada Geográfica ( punto de referencia centro del campo) Latitud y Longitud. ": "39°53'4.65\"S 70°30'48.70\"O",
        "Su establecimiento está inscripto y habilitado como criadero de fauna silvestre": "No",
        "Marque el casillero de la especies para las que solicita la práctica de caza. mayor.  Estas especies son exclusivamente para caza en establecimientos debidamente inscriptos como Criaderos de Fauna Silvestre y habilitados como Áreas de Caza Mayor.": "Ciervo Colorado, Jabalí",
        "Dentro de su campo los ciervos: (marque lo que corresponde).": "Están presentes todo el año",
        "¿Posee algún tipo de estimación numérica sobre la cantidad de ciervos que alberga su establecimiento?": "Entre 250 y 500 ciervos",
        "Dentro del intervalo elegido, indique a continuación el valor que UD estima": "400",
        "A este valor, qué porcentaje en mas y en menos, le asignará (Ej: estimación de 400 ciervos, con un 10%+/-, nos ubica el valor entre 360 y 440 ciervos).": "10%",
        "En los últimos cinco años, el número de ciervos en su campo": "Aumentó",
        "De las superficies total del establecimiento, qué porcentaje estima Ud. Que es utilizado por los ciervos": "Entre 50 y 75 %",
        "Dentro de su campo o realiza algún tipo de manejo o aprovechamiento de los ciervos colorados. ": "Caza deportiva de ciervos machos, Caza de selección de ciervos machos anormales, defectuosos o de baja calidad",
        " Indique si es de su interés mejorar la práctica de alguna de las modalidades anteriores? Cual / Cuales? ": "Caza selección de ciervos machos de baja calidad",
        "Con respecto a la proporción existente entre machos y hembras, podría indicar los porcentajes que observa de Machos y Hembras. ": "30%machos 70%hembras",
        "Machos 20%": "Macho30% Hembra70%",
        "En cuanto a los ambientes que ocupan de manera preferencial los ciervos, seleccione los ambientes donde se encuentran presentes.": "Estepa arbustiva baja, Mallín, Cañadones, Coironal",
        "Podría estimar el número de ciervos que son extraídos de su establecimiento todos los años, por los cazadores furtivos?": "10",
        "Indique en forma aproximada, la cantidad de ejemplares de jabalí europeo que alberga su establecimiento.": "150",
        "En los últimos tres años, la población de jabalí europeo:": "Se mantuvo estable",
        "Si es posible, indique en forma aproximada, la cantidad de pumas que alberga su establecimiento.": "25",
        "En los últimos tres años, la población de pumas": "Se mantuvo estable",
        "Si detectó daños provocados por puma durante el último año, cuantifique los mismos (tipo y cantidad de hacienda afectada): ": "35 ciervos y 150 guanacos",
        "En su establecimiento viven poblaciones de guanacos?": "Si",
        "En los últimos 3 años, la población de guanacos": "Aumento",
        "Que cantidad de ejemplares de esta especie estima Ud. que alberga su establecimiento?": "600",
        "Si bien la caza deportiva del guanaco no se encuentra habilitada, se pueden considerar casos especiales para la evaluación técnica de un eventual aprovechamiento de la especie en ciertos establecimientos. Solicitará Ud. dicha evaluación?": "Si",
        "Planilla completada por...": "Etienne Feune de Colombi",
        "Fecha ": "09/03/2025",
        "ID de envío": 453,
        "Fecha de creación de envío": "2025-03-09 22:37:30",
        "Estado de envío": "read"
    },
    {
        "Nombre del establecimiento": "Nahuel Mapi",
        "Razón Social": "Nahuel mapi",
        "Número CUIT": 20161541797.0,
        "WhatsApp": "2972431425",
        "Ubicación del ACM": "Ruta 23. Kilómetro 70",
        "Email Address": "nativospasito@gmail.com",
        "Superficie del establecimiento en hectáreas": 3200.0,
        "Departamento donde se ubica el establecimiento": "Huiliches",
        "Ubicación catastral (Sección - Fracción - Lote)": "Lotes 42, 43 y 44. Fracción C. Zona Andina",
        "Coordenada Geográfica ( punto de referencia centro del campo) Latitud y Longitud. ": "2330499- 5619555",
        "Su establecimiento está inscripto y habilitado como criadero de fauna silvestre": "No",
        "Marque el casillero de la especies para las que solicita la práctica de caza. mayor.  Estas especies son exclusivamente para caza en establecimientos debidamente inscriptos como Criaderos de Fauna Silvestre y habilitados como Áreas de Caza Mayor.": "Ciervo Colorado, Jabalí",
        "Dentro de su campo los ciervos: (marque lo que corresponde).": "Están presentes todo el año",
        "¿Posee algún tipo de estimación numérica sobre la cantidad de ciervos que alberga su establecimiento?": "Entre 50 y 250 ciervos",
        "Dentro del intervalo elegido, indique a continuación el valor que UD estima": "100",
        "A este valor, qué porcentaje en mas y en menos, le asignará (Ej: estimación de 400 ciervos, con un 10%+/-, nos ubica el valor entre 360 y 440 ciervos).": "100 con un 5%+/-",
        "En los últimos cinco años, el número de ciervos en su campo": "Se mantuvo estable",
        "De las superficies total del establecimiento, qué porcentaje estima Ud. Que es utilizado por los ciervos": "Mas de 75 %",
        "Dentro de su campo o realiza algún tipo de manejo o aprovechamiento de los ciervos colorados. ": "Caza deportiva de ciervos machos, Caza de selección de ciervos machos anormales, defectuosos o de baja calidad, Caza de control de cualquier ejemplar por interferencia con sistemas productivos",
        " Indique si es de su interés mejorar la práctica de alguna de las modalidades anteriores? Cual / Cuales? ": "No",
        "Con respecto a la proporción existente entre machos y hembras, podría indicar los porcentajes que observa de Machos y Hembras. ": "20% machos y 80% hembras",
        "Machos 20%": "Machos 20% y hembras 80%",
        "En cuanto a los ambientes que ocupan de manera preferencial los ciervos, seleccione los ambientes donde se encuentran presentes.": "Bosque denso, Estepa arbustiva alta, Estepa arbustiva baja, Bosque abierto, tipo parque, Costa de ríos e isla, Mallín, Cañadones, Coironal",
        "Podría estimar el número de ciervos que son extraídos de su establecimiento todos los años, por los cazadores furtivos?": "0",
        "Indique en forma aproximada, la cantidad de ejemplares de jabalí europeo que alberga su establecimiento.": "0-100",
        "En los últimos tres años, la población de jabalí europeo:": "Aumento",
        "Si es posible, indique en forma aproximada, la cantidad de pumas que alberga su establecimiento.": "10",
        "En los últimos tres años, la población de pumas": "Se mantuvo estable",
        "Si detectó daños provocados por puma durante el último año, cuantifique los mismos (tipo y cantidad de hacienda afectada): ": "Ciervos y Equinos",
        "En su establecimiento viven poblaciones de guanacos?": "No",
        "En los últimos 3 años, la población de guanacos": "No especificado",
        "Que cantidad de ejemplares de esta especie estima Ud. que alberga su establecimiento?": "No especificado",
        "Si bien la caza deportiva del guanaco no se encuentra habilitada, se pueden considerar casos especiales para la evaluación técnica de un eventual aprovechamiento de la especie en ciertos establecimientos. Solicitará Ud. dicha evaluación?": "No especificado",
        "Planilla completada por...": "José Plácido Gonzalez",
        "Fecha ": "07/03/2025",
        "ID de envío": 420,
        "Fecha de creación de envío": "2025-03-07 17:14:10",
        "Estado de envío": "read"
    },
    {
        "Nombre del establecimiento": "ESTANCIA QUILACHANQUIL",
        "Razón Social": "LA RINCONADA SCA",
        "Número CUIT": 30617082914.0,
        "WhatsApp": "2942641039",
        "Ubicación del ACM": "RUTA 15 KM 110",
        "Email Address": "ava.acsa@gmail.com",
        "Superficie del establecimiento en hectáreas": 8000.0,
        "Departamento donde se ubica el establecimiento": "ALUMINE",
        "Ubicación catastral (Sección - Fracción - Lote)": "FRACCION B",
        "Coordenada Geográfica ( punto de referencia centro del campo) Latitud y Longitud. ": "3951954S-70524831O",
        "Su establecimiento está inscripto y habilitado como criadero de fauna silvestre": "No",
        "Marque el casillero de la especies para las que solicita la práctica de caza. mayor.  Estas especies son exclusivamente para caza en establecimientos debidamente inscriptos como Criaderos de Fauna Silvestre y habilitados como Áreas de Caza Mayor.": "Ciervo Colorado",
        "Dentro de su campo los ciervos: (marque lo que corresponde).": "Están presentes todo el año",
        "¿Posee algún tipo de estimación numérica sobre la cantidad de ciervos que alberga su establecimiento?": "Entre 50 y 250 ciervos",
        "Dentro del intervalo elegido, indique a continuación el valor que UD estima": "NO SE ENTIENDE",
        "A este valor, qué porcentaje en mas y en menos, le asignará (Ej: estimación de 400 ciervos, con un 10%+/-, nos ubica el valor entre 360 y 440 ciervos).": "NO SE ENTIENDE",
        "En los últimos cinco años, el número de ciervos en su campo": "Aumentó",
        "De las superficies total del establecimiento, qué porcentaje estima Ud. Que es utilizado por los ciervos": "Mas de 75 %",
        "Dentro de su campo o realiza algún tipo de manejo o aprovechamiento de los ciervos colorados. ": "Caza deportiva de ciervos machos",
        " Indique si es de su interés mejorar la práctica de alguna de las modalidades anteriores? Cual / Cuales? ": "NO",
        "Con respecto a la proporción existente entre machos y hembras, podría indicar los porcentajes que observa de Machos y Hembras. ": "20 5 MACHOS - 80 HEMBRAS",
        "Machos 20%": "MACHO 20- HEMBRA 80",
        "En cuanto a los ambientes que ocupan de manera preferencial los ciervos, seleccione los ambientes donde se encuentran presentes.": "Estepa arbustiva alta, Estepa arbustiva baja, Costa de ríos e isla",
        "Podría estimar el número de ciervos que son extraídos de su establecimiento todos los años, por los cazadores furtivos?": "'-2",
        "Indique en forma aproximada, la cantidad de ejemplares de jabalí europeo que alberga su establecimiento.": "100",
        "En los últimos tres años, la población de jabalí europeo:": "Aumento",
        "Si es posible, indique en forma aproximada, la cantidad de pumas que alberga su establecimiento.": "NO SE SABE",
        "En los últimos tres años, la población de pumas": "Aumento",
        "Si detectó daños provocados por puma durante el último año, cuantifique los mismos (tipo y cantidad de hacienda afectada): ": "NO SE SABE",
        "En su establecimiento viven poblaciones de guanacos?": "No",
        "En los últimos 3 años, la población de guanacos": "No especificado",
        "Que cantidad de ejemplares de esta especie estima Ud. que alberga su establecimiento?": "No especificado",
        "Si bien la caza deportiva del guanaco no se encuentra habilitada, se pueden considerar casos especiales para la evaluación técnica de un eventual aprovechamiento de la especie en ciertos establecimientos. Solicitará Ud. dicha evaluación?": "No especificado",
        "Planilla completada por...": "VAZQUEZ ADELINA EDIT",
        "Fecha ": "07/03/2025",
        "ID de envío": 418,
        "Fecha de creación de envío": "2025-03-07 14:37:34",
        "Estado de envío": "read"
    },
    {
        "Nombre del establecimiento": "El Refugio",
        "Razón Social": "El Refugio",
        "Número CUIT": 20131850280.0,
        "WhatsApp": "2942404845",
        "Ubicación del ACM": "Quillen",
        "Email Address": "josequillen07@gmail.com",
        "Superficie del establecimiento en hectáreas": 500.0,
        "Departamento donde se ubica el establecimiento": "Alumine",
        "Ubicación catastral (Sección - Fracción - Lote)": "Sección andina c",
        "Coordenada Geográfica ( punto de referencia centro del campo) Latitud y Longitud. ": "40.1",
        "Su establecimiento está inscripto y habilitado como criadero de fauna silvestre": "No",
        "Marque el casillero de la especies para las que solicita la práctica de caza. mayor.  Estas especies son exclusivamente para caza en establecimientos debidamente inscriptos como Criaderos de Fauna Silvestre y habilitados como Áreas de Caza Mayor.": "Ciervo Colorado",
        "Dentro de su campo los ciervos: (marque lo que corresponde).": "Están presentes en ciertas épocas del año",
        "¿Posee algún tipo de estimación numérica sobre la cantidad de ciervos que alberga su establecimiento?": "Entre 50 y 250 ciervos",
        "Dentro del intervalo elegido, indique a continuación el valor que UD estima": "60 más o menos.machos y hmbras",
        "A este valor, qué porcentaje en mas y en menos, le asignará (Ej: estimación de 400 ciervos, con un 10%+/-, nos ubica el valor entre 360 y 440 ciervos).": "10%",
        "En los últimos cinco años, el número de ciervos en su campo": "Aumentó",
        "De las superficies total del establecimiento, qué porcentaje estima Ud. Que es utilizado por los ciervos": "Entre 50 y 75 %",
        "Dentro de su campo o realiza algún tipo de manejo o aprovechamiento de los ciervos colorados. ": "Caza deportiva de ciervos machos, Caza de selección de ciervos machos anormales, defectuosos o de baja calidad",
        " Indique si es de su interés mejorar la práctica de alguna de las modalidades anteriores? Cual / Cuales? ": "Punto B",
        "Con respecto a la proporción existente entre machos y hembras, podría indicar los porcentajes que observa de Machos y Hembras. ": "25 machos 75 hembrs",
        "Machos 20%": "25 machos 75 hembras",
        "En cuanto a los ambientes que ocupan de manera preferencial los ciervos, seleccione los ambientes donde se encuentran presentes.": "Cañadones",
        "Podría estimar el número de ciervos que son extraídos de su establecimiento todos los años, por los cazadores furtivos?": "3.4",
        "Indique en forma aproximada, la cantidad de ejemplares de jabalí europeo que alberga su establecimiento.": "30 40",
        "En los últimos tres años, la población de jabalí europeo:": "Aumento",
        "Si es posible, indique en forma aproximada, la cantidad de pumas que alberga su establecimiento.": "1 2 no es permanente",
        "En los últimos tres años, la población de pumas": "Se mantuvo estable",
        "Si detectó daños provocados por puma durante el último año, cuantifique los mismos (tipo y cantidad de hacienda afectada): ": "2 o3 ciervas",
        "En su establecimiento viven poblaciones de guanacos?": "No",
        "En los últimos 3 años, la población de guanacos": "No especificado",
        "Que cantidad de ejemplares de esta especie estima Ud. que alberga su establecimiento?": "No especificado",
        "Si bien la caza deportiva del guanaco no se encuentra habilitada, se pueden considerar casos especiales para la evaluación técnica de un eventual aprovechamiento de la especie en ciertos establecimientos. Solicitará Ud. dicha evaluación?": "No especificado",
        "Planilla completada por...": "Jose Maria ochoa",
        "Fecha ": "07/03/2025",
        "ID de envío": 413,
        "Fecha de creación de envío": "2025-03-07 09:05:45",
        "Estado de envío": "read"
    },
    {
        "Nombre del establecimiento": "Estancia Chimehuin",
        "Razón Social": "Estancia Chimehuin SA",
        "Número CUIT": 30711634572.0,
        "WhatsApp": "1159557006",
        "Ubicación del ACM": "Ruta 40km 17",
        "Email Address": "estanciachimehuin@gmail.com",
        "Superficie del establecimiento en hectáreas": 1000.0,
        "Departamento donde se ubica el establecimiento": "Lacar",
        "Ubicación catastral (Sección - Fracción - Lote)": "023-5748-0000",
        "Coordenada Geográfica ( punto de referencia centro del campo) Latitud y Longitud. ": "40- 70,9",
        "Su establecimiento está inscripto y habilitado como criadero de fauna silvestre": "No",
        "Marque el casillero de la especies para las que solicita la práctica de caza. mayor.  Estas especies son exclusivamente para caza en establecimientos debidamente inscriptos como Criaderos de Fauna Silvestre y habilitados como Áreas de Caza Mayor.": "Ciervo Colorado",
        "Dentro de su campo los ciervos: (marque lo que corresponde).": "Están presentes todo el año",
        "¿Posee algún tipo de estimación numérica sobre la cantidad de ciervos que alberga su establecimiento?": "Entre 250 y 500 ciervos",
        "Dentro del intervalo elegido, indique a continuación el valor que UD estima": "200",
        "A este valor, qué porcentaje en mas y en menos, le asignará (Ej: estimación de 400 ciervos, con un 10%+/-, nos ubica el valor entre 360 y 440 ciervos).": "180 y 220",
        "En los últimos cinco años, el número de ciervos en su campo": "Aumentó",
        "De las superficies total del establecimiento, qué porcentaje estima Ud. Que es utilizado por los ciervos": "Entre 50 y 75 %",
        "Dentro de su campo o realiza algún tipo de manejo o aprovechamiento de los ciervos colorados. ": "Caza deportiva de ciervos machos, Caza de selección de ciervos machos anormales, defectuosos o de baja calidad",
        " Indique si es de su interés mejorar la práctica de alguna de las modalidades anteriores? Cual / Cuales? ": "No",
        "Con respecto a la proporción existente entre machos y hembras, podría indicar los porcentajes que observa de Machos y Hembras. ": "20-80",
        "Machos 20%": "20-80",
        "En cuanto a los ambientes que ocupan de manera preferencial los ciervos, seleccione los ambientes donde se encuentran presentes.": "Bosque denso",
        "Podría estimar el número de ciervos que son extraídos de su establecimiento todos los años, por los cazadores furtivos?": "10",
        "Indique en forma aproximada, la cantidad de ejemplares de jabalí europeo que alberga su establecimiento.": "200",
        "En los últimos tres años, la población de jabalí europeo:": "Aumento",
        "Si es posible, indique en forma aproximada, la cantidad de pumas que alberga su establecimiento.": "4",
        "En los últimos tres años, la población de pumas": "Se mantuvo estable",
        "Si detectó daños provocados por puma durante el último año, cuantifique los mismos (tipo y cantidad de hacienda afectada): ": "No",
        "En su establecimiento viven poblaciones de guanacos?": "Si",
        "En los últimos 3 años, la población de guanacos": "Se mantuvo estable",
        "Que cantidad de ejemplares de esta especie estima Ud. que alberga su establecimiento?": "10",
        "Si bien la caza deportiva del guanaco no se encuentra habilitada, se pueden considerar casos especiales para la evaluación técnica de un eventual aprovechamiento de la especie en ciertos establecimientos. Solicitará Ud. dicha evaluación?": "No",
        "Planilla completada por...": "Clara Rubio",
        "Fecha ": "06/03/2025",
        "ID de envío": 376,
        "Fecha de creación de envío": "2025-03-06 17:56:45",
        "Estado de envío": "read"
    },
    {
        "Nombre del establecimiento": "Estancia Paylacura S.A.",
        "Razón Social": "PAYLACURA SA",
        "Número CUIT": 30631761689.0,
        "WhatsApp": "2944296101",
        "Ubicación del ACM": "Ruta 40-Arroyo Chapelco-San Martin de los Andes- Lacar- Neuquen",
        "Email Address": "diegomurphy@yahoo.com",
        "Superficie del establecimiento en hectáreas": 11000.0,
        "Departamento donde se ubica el establecimiento": "Lacar",
        "Ubicación catastral (Sección - Fracción - Lote)": "15RR02343180000-15RR02339220000-15RR02345230000",
        "Coordenada Geográfica ( punto de referencia centro del campo) Latitud y Longitud. ": "'-40.121924, -71.114901",
        "Su establecimiento está inscripto y habilitado como criadero de fauna silvestre": "No",
        "Marque el casillero de la especies para las que solicita la práctica de caza. mayor.  Estas especies son exclusivamente para caza en establecimientos debidamente inscriptos como Criaderos de Fauna Silvestre y habilitados como Áreas de Caza Mayor.": "Ciervo Colorado",
        "Dentro de su campo los ciervos: (marque lo que corresponde).": "Están presentes todo el año",
        "¿Posee algún tipo de estimación numérica sobre la cantidad de ciervos que alberga su establecimiento?": "Entre 50 y 250 ciervos",
        "Dentro del intervalo elegido, indique a continuación el valor que UD estima": "150",
        "A este valor, qué porcentaje en mas y en menos, le asignará (Ej: estimación de 400 ciervos, con un 10%+/-, nos ubica el valor entre 360 y 440 ciervos).": "20%",
        "En los últimos cinco años, el número de ciervos en su campo": "Se mantuvo estable",
        "De las superficies total del establecimiento, qué porcentaje estima Ud. Que es utilizado por los ciervos": "Entre 50 y 75 %",
        "Dentro de su campo o realiza algún tipo de manejo o aprovechamiento de los ciervos colorados. ": "Caza deportiva de ciervos machos, Caza de selección de ciervos machos anormales, defectuosos o de baja calidad",
        " Indique si es de su interés mejorar la práctica de alguna de las modalidades anteriores? Cual / Cuales? ": "Las 2 seleccionadas",
        "Con respecto a la proporción existente entre machos y hembras, podría indicar los porcentajes que observa de Machos y Hembras. ": "30% machos - 70% Hembras",
        "Machos 20%": "30% Machos - 70% hembras",
        "En cuanto a los ambientes que ocupan de manera preferencial los ciervos, seleccione los ambientes donde se encuentran presentes.": "Bosque denso, Mallín, Cañadones, Coironal",
        "Podría estimar el número de ciervos que son extraídos de su establecimiento todos los años, por los cazadores furtivos?": "8",
        "Indique en forma aproximada, la cantidad de ejemplares de jabalí europeo que alberga su establecimiento.": "80-120",
        "En los últimos tres años, la población de jabalí europeo:": "Aumento",
        "Si es posible, indique en forma aproximada, la cantidad de pumas que alberga su establecimiento.": "8-10",
        "En los últimos tres años, la población de pumas": "Se mantuvo estable",
        "Si detectó daños provocados por puma durante el último año, cuantifique los mismos (tipo y cantidad de hacienda afectada): ": "Ciervos varios",
        "En su establecimiento viven poblaciones de guanacos?": "No",
        "En los últimos 3 años, la población de guanacos": "No especificado",
        "Que cantidad de ejemplares de esta especie estima Ud. que alberga su establecimiento?": "No especificado",
        "Si bien la caza deportiva del guanaco no se encuentra habilitada, se pueden considerar casos especiales para la evaluación técnica de un eventual aprovechamiento de la especie en ciertos establecimientos. Solicitará Ud. dicha evaluación?": "No especificado",
        "Planilla completada por...": "Diego Murphy",
        "Fecha ": "06/03/2025",
        "ID de envío": 375,
        "Fecha de creación de envío": "2025-03-06 17:28:10",
        "Estado de envío": "read"
    },
    {
        "Nombre del establecimiento": "Estancia Rahue",
        "Razón Social": "Rambeaud Susana Beatriz",
        "Número CUIT": 27057480985.0,
        "WhatsApp": "2942695000",
        "Ubicación del ACM": "Ruta 46 intersección ruta 23",
        "Email Address": "mesebastiano@hotmail.com",
        "Superficie del establecimiento en hectáreas": 7300.0,
        "Departamento donde se ubica el establecimiento": "Alumine",
        "Ubicación catastral (Sección - Fracción - Lote)": "Lote B NC 12RR 019 6444 0000",
        "Coordenada Geográfica ( punto de referencia centro del campo) Latitud y Longitud. ": "'-39.372496, -70.902873",
        "Su establecimiento está inscripto y habilitado como criadero de fauna silvestre": "No",
        "Marque el casillero de la especies para las que solicita la práctica de caza. mayor.  Estas especies son exclusivamente para caza en establecimientos debidamente inscriptos como Criaderos de Fauna Silvestre y habilitados como Áreas de Caza Mayor.": "Ciervo Colorado",
        "Dentro de su campo los ciervos: (marque lo que corresponde).": "Están presentes todo el año",
        "¿Posee algún tipo de estimación numérica sobre la cantidad de ciervos que alberga su establecimiento?": "Entre 50 y 250 ciervos",
        "Dentro del intervalo elegido, indique a continuación el valor que UD estima": "200",
        "A este valor, qué porcentaje en mas y en menos, le asignará (Ej: estimación de 400 ciervos, con un 10%+/-, nos ubica el valor entre 360 y 440 ciervos).": "20%",
        "En los últimos cinco años, el número de ciervos en su campo": "Se mantuvo estable",
        "De las superficies total del establecimiento, qué porcentaje estima Ud. Que es utilizado por los ciervos": "Entre 50 y 75 %",
        "Dentro de su campo o realiza algún tipo de manejo o aprovechamiento de los ciervos colorados. ": "Caza deportiva de ciervos machos, Caza de selección de ciervos machos anormales, defectuosos o de baja calidad",
        " Indique si es de su interés mejorar la práctica de alguna de las modalidades anteriores? Cual / Cuales? ": "Quisiera que mejore el control para evitar la caza furtiva en el campo",
        "Con respecto a la proporción existente entre machos y hembras, podría indicar los porcentajes que observa de Machos y Hembras. ": "20% machos 80 % hembras",
        "Machos 20%": "Macho 20 % hembras 80%",
        "En cuanto a los ambientes que ocupan de manera preferencial los ciervos, seleccione los ambientes donde se encuentran presentes.": "Mallín",
        "Podría estimar el número de ciervos que son extraídos de su establecimiento todos los años, por los cazadores furtivos?": "3",
        "Indique en forma aproximada, la cantidad de ejemplares de jabalí europeo que alberga su establecimiento.": "20",
        "En los últimos tres años, la población de jabalí europeo:": "Aumento",
        "Si es posible, indique en forma aproximada, la cantidad de pumas que alberga su establecimiento.": "2 vi rastros",
        "En los últimos tres años, la población de pumas": "Se mantuvo estable",
        "Si detectó daños provocados por puma durante el último año, cuantifique los mismos (tipo y cantidad de hacienda afectada): ": "No",
        "En su establecimiento viven poblaciones de guanacos?": "No",
        "En los últimos 3 años, la población de guanacos": "No especificado",
        "Que cantidad de ejemplares de esta especie estima Ud. que alberga su establecimiento?": "No especificado",
        "Si bien la caza deportiva del guanaco no se encuentra habilitada, se pueden considerar casos especiales para la evaluación técnica de un eventual aprovechamiento de la especie en ciertos establecimientos. Solicitará Ud. dicha evaluación?": "No especificado",
        "Planilla completada por...": "Eugenia Sebastiano Rambeaud",
        "Fecha ": "06/03/2025",
        "ID de envío": 374,
        "Fecha de creación de envío": "2025-03-06 15:28:32",
        "Estado de envío": "read"
    },
    {
        "Nombre del establecimiento": "Estancia Santa Rosa",
        "Razón Social": "Cordero Mariana",
        "Número CUIT": 27181009468.0,
        "WhatsApp": "02942368046",
        "Ubicación del ACM": "Ruta 46 , Quillen.",
        "Email Address": "camipsr95@gmail.com",
        "Superficie del establecimiento en hectáreas": 500.0,
        "Departamento donde se ubica el establecimiento": "Alumine",
        "Ubicación catastral (Sección - Fracción - Lote)": "seccion C - Lote 4 y 5",
        "Coordenada Geográfica ( punto de referencia centro del campo) Latitud y Longitud. ": "'-39.3813080, -70.9482731",
        "Su establecimiento está inscripto y habilitado como criadero de fauna silvestre": "No",
        "Marque el casillero de la especies para las que solicita la práctica de caza. mayor.  Estas especies son exclusivamente para caza en establecimientos debidamente inscriptos como Criaderos de Fauna Silvestre y habilitados como Áreas de Caza Mayor.": "Ciervo Colorado",
        "Dentro de su campo los ciervos: (marque lo que corresponde).": "Están presentes todo el año",
        "¿Posee algún tipo de estimación numérica sobre la cantidad de ciervos que alberga su establecimiento?": "Entre 50 y 250 ciervos",
        "Dentro del intervalo elegido, indique a continuación el valor que UD estima": "100",
        "A este valor, qué porcentaje en mas y en menos, le asignará (Ej: estimación de 400 ciervos, con un 10%+/-, nos ubica el valor entre 360 y 440 ciervos).": "no se entiende la pregunta",
        "En los últimos cinco años, el número de ciervos en su campo": "Aumentó",
        "De las superficies total del establecimiento, qué porcentaje estima Ud. Que es utilizado por los ciervos": "Entre 25 % y 50 %",
        "Dentro de su campo o realiza algún tipo de manejo o aprovechamiento de los ciervos colorados. ": "Caza deportiva de ciervos machos",
        " Indique si es de su interés mejorar la práctica de alguna de las modalidades anteriores? Cual / Cuales? ": "no",
        "Con respecto a la proporción existente entre machos y hembras, podría indicar los porcentajes que observa de Machos y Hembras. ": "20% macho y 80% hembras",
        "Machos 20%": "20% machos, 80% hembras",
        "En cuanto a los ambientes que ocupan de manera preferencial los ciervos, seleccione los ambientes donde se encuentran presentes.": "Estepa arbustiva baja, Estepa arbustiva alta, Mallín, Cañadones, Coironal",
        "Podría estimar el número de ciervos que son extraídos de su establecimiento todos los años, por los cazadores furtivos?": "'-1",
        "Indique en forma aproximada, la cantidad de ejemplares de jabalí europeo que alberga su establecimiento.": "100",
        "En los últimos tres años, la población de jabalí europeo:": "Aumento",
        "Si es posible, indique en forma aproximada, la cantidad de pumas que alberga su establecimiento.": "no se",
        "En los últimos tres años, la población de pumas": "Se mantuvo estable",
        "Si detectó daños provocados por puma durante el último año, cuantifique los mismos (tipo y cantidad de hacienda afectada): ": "no",
        "En su establecimiento viven poblaciones de guanacos?": "No",
        "En los últimos 3 años, la población de guanacos": "No especificado",
        "Que cantidad de ejemplares de esta especie estima Ud. que alberga su establecimiento?": "No especificado",
        "Si bien la caza deportiva del guanaco no se encuentra habilitada, se pueden considerar casos especiales para la evaluación técnica de un eventual aprovechamiento de la especie en ciertos establecimientos. Solicitará Ud. dicha evaluación?": "No especificado",
        "Planilla completada por...": "Cordero Mariana",
        "Fecha ": "06/03/2025",
        "ID de envío": 369,
        "Fecha de creación de envío": "2025-03-06 11:37:05",
        "Estado de envío": "read"
    },
    {
        "Nombre del establecimiento": "San Pedro",
        "Razón Social": "San Cabao SA",
        "Número CUIT": 33661995489.0,
        "WhatsApp": "1159465045",
        "Ubicación del ACM": "Ruta 61, Junín de los Andes",
        "Email Address": "gui.gfh@gmail.com",
        "Superficie del establecimiento en hectáreas": 20000.0,
        "Departamento donde se ubica el establecimiento": "Huiliches",
        "Ubicación catastral (Sección - Fracción - Lote)": "13-RR-019-0623-0000",
        "Coordenada Geográfica ( punto de referencia centro del campo) Latitud y Longitud. ": "'-39,5120. -71,1130",
        "Su establecimiento está inscripto y habilitado como criadero de fauna silvestre": "No",
        "Marque el casillero de la especies para las que solicita la práctica de caza. mayor.  Estas especies son exclusivamente para caza en establecimientos debidamente inscriptos como Criaderos de Fauna Silvestre y habilitados como Áreas de Caza Mayor.": "Ciervo Colorado",
        "Dentro de su campo los ciervos: (marque lo que corresponde).": "Están presentes todo el año",
        "¿Posee algún tipo de estimación numérica sobre la cantidad de ciervos que alberga su establecimiento?": "Entre 250 y 500 ciervos",
        "Dentro del intervalo elegido, indique a continuación el valor que UD estima": "450",
        "A este valor, qué porcentaje en mas y en menos, le asignará (Ej: estimación de 400 ciervos, con un 10%+/-, nos ubica el valor entre 360 y 440 ciervos).": "20",
        "En los últimos cinco años, el número de ciervos en su campo": "Se mantuvo estable",
        "De las superficies total del establecimiento, qué porcentaje estima Ud. Que es utilizado por los ciervos": "Entre 5 y 25 %",
        "Dentro de su campo o realiza algún tipo de manejo o aprovechamiento de los ciervos colorados. ": "Caza de control de ciervos hembra (sin aprovechamiento de la carne), Caza deportiva de ciervos machos, Caza de selección de ciervos machos anormales, defectuosos o de baja calidad",
        " Indique si es de su interés mejorar la práctica de alguna de las modalidades anteriores? Cual / Cuales? ": "No",
        "Con respecto a la proporción existente entre machos y hembras, podría indicar los porcentajes que observa de Machos y Hembras. ": "15% machos, 85% hembras",
        "Machos 20%": "10 % machos, 90% hembras",
        "En cuanto a los ambientes que ocupan de manera preferencial los ciervos, seleccione los ambientes donde se encuentran presentes.": "Mallín",
        "Podría estimar el número de ciervos que son extraídos de su establecimiento todos los años, por los cazadores furtivos?": "No especificado",
        "Indique en forma aproximada, la cantidad de ejemplares de jabalí europeo que alberga su establecimiento.": "150",
        "En los últimos tres años, la población de jabalí europeo:": "Se mantuvo estable",
        "Si es posible, indique en forma aproximada, la cantidad de pumas que alberga su establecimiento.": "no se",
        "En los últimos tres años, la población de pumas": "Se mantuvo estable",
        "Si detectó daños provocados por puma durante el último año, cuantifique los mismos (tipo y cantidad de hacienda afectada): ": "si datos",
        "En su establecimiento viven poblaciones de guanacos?": "No",
        "En los últimos 3 años, la población de guanacos": "No especificado",
        "Que cantidad de ejemplares de esta especie estima Ud. que alberga su establecimiento?": "No especificado",
        "Si bien la caza deportiva del guanaco no se encuentra habilitada, se pueden considerar casos especiales para la evaluación técnica de un eventual aprovechamiento de la especie en ciertos establecimientos. Solicitará Ud. dicha evaluación?": "No especificado",
        "Planilla completada por...": "Guillermo Facht",
        "Fecha ": "06/03/2025",
        "ID de envío": 368,
        "Fecha de creación de envío": "2025-03-06 09:27:08",
        "Estado de envío": "read"
    },
    {
        "Nombre del establecimiento": "Collunco",
        "Razón Social": "Collunco sa",
        "Número CUIT": 30.0,
        "WhatsApp": "1144118632",
        "Ubicación del ACM": "ruta 52 y 40",
        "Email Address": "marinafacht@gmail.com",
        "Superficie del establecimiento en hectáreas": 20000.0,
        "Departamento donde se ubica el establecimiento": "huiliches",
        "Ubicación catastral (Sección - Fracción - Lote)": "seccXXXIII fracc14/15/18/19/1/2/3 lote 10/11/20/21",
        "Coordenada Geográfica ( punto de referencia centro del campo) Latitud y Longitud. ": "no las tengo",
        "Su establecimiento está inscripto y habilitado como criadero de fauna silvestre": "No",
        "Marque el casillero de la especies para las que solicita la práctica de caza. mayor.  Estas especies son exclusivamente para caza en establecimientos debidamente inscriptos como Criaderos de Fauna Silvestre y habilitados como Áreas de Caza Mayor.": "Ciervo Colorado, Jabalí",
        "Dentro de su campo los ciervos: (marque lo que corresponde).": "Están presentes todo el año",
        "¿Posee algún tipo de estimación numérica sobre la cantidad de ciervos que alberga su establecimiento?": "Hasta 50 ciervos",
        "Dentro del intervalo elegido, indique a continuación el valor que UD estima": "'-",
        "A este valor, qué porcentaje en mas y en menos, le asignará (Ej: estimación de 400 ciervos, con un 10%+/-, nos ubica el valor entre 360 y 440 ciervos).": "Hoy sería imposible saber ya que el movimiento de helicópteros y aviones por el incendio ha afectado mucho la población por la cercanía al aeropuerto",
        "En los últimos cinco años, el número de ciervos en su campo": "Disminuyó",
        "De las superficies total del establecimiento, qué porcentaje estima Ud. Que es utilizado por los ciervos": "Entre 5 y 25 %",
        "Dentro de su campo o realiza algún tipo de manejo o aprovechamiento de los ciervos colorados. ": "Caza deportiva de ciervos machos, Caza de selección de ciervos machos anormales, defectuosos o de baja calidad",
        " Indique si es de su interés mejorar la práctica de alguna de las modalidades anteriores? Cual / Cuales? ": "No",
        "Con respecto a la proporción existente entre machos y hembras, podría indicar los porcentajes que observa de Machos y Hembras. ": "50 50 la población de hembras se ha reducido mucho,furtivismo",
        "Machos 20%": "1/2 machos",
        "En cuanto a los ambientes que ocupan de manera preferencial los ciervos, seleccione los ambientes donde se encuentran presentes.": "Mallín, Bosque abierto, tipo parque, Estepa arbustiva baja, Estepa arbustiva alta",
        "Podría estimar el número de ciervos que son extraídos de su establecimiento todos los años, por los cazadores furtivos?": "No especificado",
        "Indique en forma aproximada, la cantidad de ejemplares de jabalí europeo que alberga su establecimiento.": "200",
        "En los últimos tres años, la población de jabalí europeo:": "Aumento",
        "Si es posible, indique en forma aproximada, la cantidad de pumas que alberga su establecimiento.": "No se puede calcular varios",
        "En los últimos tres años, la población de pumas": "Se mantuvo estable",
        "Si detectó daños provocados por puma durante el último año, cuantifique los mismos (tipo y cantidad de hacienda afectada): ": "Por suerte solo chulengos",
        "En su establecimiento viven poblaciones de guanacos?": "No",
        "En los últimos 3 años, la población de guanacos": "No especificado",
        "Que cantidad de ejemplares de esta especie estima Ud. que alberga su establecimiento?": "No especificado",
        "Si bien la caza deportiva del guanaco no se encuentra habilitada, se pueden considerar casos especiales para la evaluación técnica de un eventual aprovechamiento de la especie en ciertos establecimientos. Solicitará Ud. dicha evaluación?": "No especificado",
        "Planilla completada por...": "Marina Facht",
        "Fecha ": "06/03/2025",
        "ID de envío": 367,
        "Fecha de creación de envío": "2025-03-06 08:54:13",
        "Estado de envío": "read"
    },
    {
        "Nombre del establecimiento": "Ea. Lago Machonico",
        "Razón Social": "Von Buchholtz Bruno Wolf Guillermo",
        "Número CUIT": 20.0,
        "WhatsApp": "'+54-911-5002-3691",
        "Ubicación del ACM": "Ruta 40 km 2191 y Ruta 63 km 7.5",
        "Email Address": "christianstv@gmail.com",
        "Superficie del establecimiento en hectáreas": 9362.04,
        "Departamento donde se ubica el establecimiento": "Lacar",
        "Ubicación catastral (Sección - Fracción - Lote)": "15-RR-023-3711 y 15-RR-023-3117",
        "Coordenada Geográfica ( punto de referencia centro del campo) Latitud y Longitud. ": "40*17'18\"S 71*21´47\"W / 40*20´33\"S 71*16´42\"W",
        "Su establecimiento está inscripto y habilitado como criadero de fauna silvestre": "No",
        "Marque el casillero de la especies para las que solicita la práctica de caza. mayor.  Estas especies son exclusivamente para caza en establecimientos debidamente inscriptos como Criaderos de Fauna Silvestre y habilitados como Áreas de Caza Mayor.": "Ciervo Colorado",
        "Dentro de su campo los ciervos: (marque lo que corresponde).": "Están presentes todo el año",
        "¿Posee algún tipo de estimación numérica sobre la cantidad de ciervos que alberga su establecimiento?": "Hasta 50 ciervos",
        "Dentro del intervalo elegido, indique a continuación el valor que UD estima": "40",
        "A este valor, qué porcentaje en mas y en menos, le asignará (Ej: estimación de 400 ciervos, con un 10%+/-, nos ubica el valor entre 360 y 440 ciervos).": "10%",
        "En los últimos cinco años, el número de ciervos en su campo": "Se mantuvo estable",
        "De las superficies total del establecimiento, qué porcentaje estima Ud. Que es utilizado por los ciervos": "Menos de un 5 %",
        "Dentro de su campo o realiza algún tipo de manejo o aprovechamiento de los ciervos colorados. ": "Caza deportiva de ciervos machos, Caza de selección de ciervos machos anormales, defectuosos o de baja calidad",
        " Indique si es de su interés mejorar la práctica de alguna de las modalidades anteriores? Cual / Cuales? ": "NO",
        "Con respecto a la proporción existente entre machos y hembras, podría indicar los porcentajes que observa de Machos y Hembras. ": "10 % Machos y 90 % Hembras",
        "Machos 20%": "20 % Machos y 80 % hembras",
        "En cuanto a los ambientes que ocupan de manera preferencial los ciervos, seleccione los ambientes donde se encuentran presentes.": "Mallín, Cañadones, Estepa arbustiva alta",
        "Podría estimar el número de ciervos que son extraídos de su establecimiento todos los años, por los cazadores furtivos?": "5",
        "Indique en forma aproximada, la cantidad de ejemplares de jabalí europeo que alberga su establecimiento.": "20",
        "En los últimos tres años, la población de jabalí europeo:": "Aumento",
        "Si es posible, indique en forma aproximada, la cantidad de pumas que alberga su establecimiento.": "6",
        "En los últimos tres años, la población de pumas": "Aumento",
        "Si detectó daños provocados por puma durante el último año, cuantifique los mismos (tipo y cantidad de hacienda afectada): ": "6 Ciervas y 1 caballo",
        "En su establecimiento viven poblaciones de guanacos?": "No",
        "En los últimos 3 años, la población de guanacos": "No especificado",
        "Que cantidad de ejemplares de esta especie estima Ud. que alberga su establecimiento?": "No especificado",
        "Si bien la caza deportiva del guanaco no se encuentra habilitada, se pueden considerar casos especiales para la evaluación técnica de un eventual aprovechamiento de la especie en ciertos establecimientos. Solicitará Ud. dicha evaluación?": "No especificado",
        "Planilla completada por...": "Christian M. Steverlynck",
        "Fecha ": "05/03/2025",
        "ID de envío": 357,
        "Fecha de creación de envío": "2025-03-05 23:13:17",
        "Estado de envío": "read"
    },
    {
        "Nombre del establecimiento": "Estancia Belisle",
        "Razón Social": "QUILA LAFQUEN SRL",
        "Número CUIT": 30692212378.0,
        "WhatsApp": "01150069990",
        "Ubicación del ACM": "Ruta 46, km 80",
        "Email Address": "comercial@quilalafquen.com",
        "Superficie del establecimiento en hectáreas": 7000.0,
        "Departamento donde se ubica el establecimiento": "Catan Lil",
        "Ubicación catastral (Sección - Fracción - Lote)": "11RR0197071",
        "Coordenada Geográfica ( punto de referencia centro del campo) Latitud y Longitud. ": "39°22'17\"S 70°40'30\"W",
        "Su establecimiento está inscripto y habilitado como criadero de fauna silvestre": "No",
        "Marque el casillero de la especies para las que solicita la práctica de caza. mayor.  Estas especies son exclusivamente para caza en establecimientos debidamente inscriptos como Criaderos de Fauna Silvestre y habilitados como Áreas de Caza Mayor.": "Ciervo Colorado, Jabalí",
        "Dentro de su campo los ciervos: (marque lo que corresponde).": "Están presentes todo el año",
        "¿Posee algún tipo de estimación numérica sobre la cantidad de ciervos que alberga su establecimiento?": "Entre 250 y 500 ciervos",
        "Dentro del intervalo elegido, indique a continuación el valor que UD estima": "3 manadas de 50 y una de 100 estimada",
        "A este valor, qué porcentaje en mas y en menos, le asignará (Ej: estimación de 400 ciervos, con un 10%+/-, nos ubica el valor entre 360 y 440 ciervos).": "'+/- 25%",
        "En los últimos cinco años, el número de ciervos en su campo": "Aumentó",
        "De las superficies total del establecimiento, qué porcentaje estima Ud. Que es utilizado por los ciervos": "Entre 25 % y 50 %",
        "Dentro de su campo o realiza algún tipo de manejo o aprovechamiento de los ciervos colorados. ": "Ninguna de las anteriores",
        " Indique si es de su interés mejorar la práctica de alguna de las modalidades anteriores? Cual / Cuales? ": "Si, Caza deportiva de Machos, control poblacional por interferencia en la produccion pecuaria",
        "Con respecto a la proporción existente entre machos y hembras, podría indicar los porcentajes que observa de Machos y Hembras. ": "Machos 15 al 20% - Hembras 80 al 85%",
        "Machos 20%": "20% Machos - 80% hembras",
        "En cuanto a los ambientes que ocupan de manera preferencial los ciervos, seleccione los ambientes donde se encuentran presentes.": "Cañadones, Bosque denso, Estepa arbustiva alta, Costa de ríos e isla, Mallín, Coironal",
        "Podría estimar el número de ciervos que son extraídos de su establecimiento todos los años, por los cazadores furtivos?": "4",
        "Indique en forma aproximada, la cantidad de ejemplares de jabalí europeo que alberga su establecimiento.": "70",
        "En los últimos tres años, la población de jabalí europeo:": "Aumento",
        "Si es posible, indique en forma aproximada, la cantidad de pumas que alberga su establecimiento.": "8",
        "En los últimos tres años, la población de pumas": "Aumento",
        "Si detectó daños provocados por puma durante el último año, cuantifique los mismos (tipo y cantidad de hacienda afectada): ": "CON UNA FRECUENCIA AL MENOS ANUAL, INGRESA AL CORRAL DE BOVINOS DEL CAMPO, PROVOCANDO MORTANDADES MASIVAS. DEPENDIENDO DEL AÑO O INDIVIDUO DE QUE SE TRATE, LAS PÉRDIDAS VAN ENTRE LOS 15 Y 30 OVINOS DE DISTINTAS EDADES. DADA LA EXTENSIÓN DEL CAMPO, NOS RESULTA MUY DIFICULTOSO DETERMINAR QUÉ INCIDENCIA POSEE EL PUMA EN LAS MERMAS PRODUCTIVAS POR MORTANDAD BOVINA, PERO ES FRECUENTE HALLAR RESTOS DE TERNEROS RECIEN NACIDOS TOTAL O PARCIALMENTE COMIDOS, OCULTOS EN SECTORES MÁS DENSOS DE LA ESTEPA, ARBUSTOS, ETC.",
        "En su establecimiento viven poblaciones de guanacos?": "Si",
        "En los últimos 3 años, la población de guanacos": "Aumento",
        "Que cantidad de ejemplares de esta especie estima Ud. que alberga su establecimiento?": "40",
        "Si bien la caza deportiva del guanaco no se encuentra habilitada, se pueden considerar casos especiales para la evaluación técnica de un eventual aprovechamiento de la especie en ciertos establecimientos. Solicitará Ud. dicha evaluación?": "No",
        "Planilla completada por...": "Juan Rodrigo Marrodan Ginesta",
        "Fecha ": "05/03/2025",
        "ID de envío": 352,
        "Fecha de creación de envío": "2025-03-05 18:21:07",
        "Estado de envío": "read"
    },
    {
        "Nombre del establecimiento": "Estancia Collon Cura",
        "Razón Social": "La primavera Arg Llc",
        "Número CUIT": 33687321389.0,
        "WhatsApp": "2944236430",
        "Ubicación del ACM": "Ruta 234, km 21, pje Piedra del Aguila",
        "Email Address": "cruz@colloncura.com",
        "Superficie del establecimiento en hectáreas": 37.0,
